2008,62,1,Building Control,"The Housing Department (HD) is delegated with the authority over building control of the Housing Authority (HA)’s buildings that have been sold or otherwise disposed of under sections 4(2)(a) or 17A of the Housing Ordinance. The aim is for the Independent Checking Unit (ICU) of the Department to exercise building control of these former HA’s buildings, in accordance with the Buildings Department (BD)’s current practice on building control of private housing, and to make a bi-annual report to the Director of Buildings.",62.9,64.3,68.7,68.8
2008,62,2,Private Housing,"The aim is to maintain an orderly, fair and free environment to facilitate the stable and healthy development of the private residential property market.",11.0,14.9,15.1,17.2
2008,62,3,Appeal Panel (Housing),"The aim is to provide administrative and secretarial support to the Appeal Panel (Housing) to ensure that appeals lodged under the Housing Ordinance against the termination of leases by the HA are handled in a thorough, impartial and efficient manner.",4.5,9.6,9.3,11.9
2008,62,4,Rehousing of Occupants upon Clearance,"The aim is to provide rehousing assistance to eligible clearees affected by government actions in land clearance, victims of natural disasters and other emergency incidents.",14.1,16.7,14.5,16.5
2008,62,5,Support Services,The aim is to provide efficient and effective support services for housing-related matters and infrastructure projects.,,11.2,11.2,11.2
2008,62,0,total,,92.5,116.7,118.8,125.6
2008,63,1,District Administration,"The aims are to develop policy in respect of the District Administration Scheme, to encourage public participation in the Scheme and through it to enhance the capacity to resolve problems in districts and to ensure that public policies are effectively implemented at the district level.",497.4,565.0,561.8,618.4
2008,63,2,Community Building,The aims are to develop policy in respect of community building and to promote community involvement activities and public participation in community affairs.,494.1,565.4,532.9,701.1
2008,63,3,Local Environmental Improvements,The aim is to improve the local environment through minor works.,163.6,174.3,169.2,175.8
2008,63,4,Licensing,"The aim is to implement the Hotel and Guesthouse Accommodation Ordinance (Cap. 349), the Clubs (Safety of Premises) Ordinance (Cap. 376), the Bedspace Apartments Ordinance (Cap. 447) and the Karaoke Establishments Ordinance (Cap. 573) and to process permits for non-charitable fund-raising activities.",32.0,33.5,33.3,34.5
2008,63,5,Territory Planning and Development,The aim is to assist relevant bureaux and departments in gauging local views on the planning and development projects of the territory.,16.3,17.1,17.0,17.5
2008,63,0,total,,1203.4,1355.3,1314.2,1547.3
2008,70,1,Pre-entry Control,The aim is to control legal immigration and the entry of foreign workers and undesirable persons through the visa system.,163.1,171.1,192.7,195.2
2008,70,2,Control upon Entry,"The aims are to exercise quantitative and qualitative control over legal immigration, prevent the entry of undesirable persons and the departure of persons wanted for criminal offences, facilitate the movement of bona-fide tourists, business visitors and local residents, and process cross-boundary vehicles.",1089.9,1377.8,1397.5,1491.2
2008,70,3,Control after Entry,"The aim is to exercise immigration control by granting or refusing extension of stay; investigating and prosecuting offenders under the Immigration, Immigration Service, Registration of Persons, Marriage, Births and Deaths Ordinances, and certain provisions under the Crimes Ordinance; removing or deporting illegal immigrants, overstayers and undesirable persons from Hong Kong; and assessing cases with claims made under the Convention Against Torture and Other Cruel, Inhuman or Degrading Treatment or Punishment.",417.0,444.3,477.8,484.7
2008,70,4,Personal Documentation,"The aim is to counteract illegal immigration and enhance the maintenance of law and order by providing all legal residents with a secure form of identity card and all consequential services related to identity cards; to register births, deaths and marriages and provide all consequential services related to such civil registration; to assess right of abode claims; and to facilitate international travel of Hong Kong residents by providing them with travel documents.",563.1,596.8,542.6,524.3
2008,70,5,Nationality and Assistance to HKSAR Residents outside Hong Kong,"From 1 July 1997, the Department is authorised by the Central People’s Government to deal with Chinese nationality matters in respect of residents in the HKSAR in accordance with the Nationality Law of the People’s Republic of China and the ‘Explanations’ adopted by the Standing Committee of the National People’s Congress. On 1 February 2000, the Department started to accept applications outside Hong Kong for declaration of change of nationality, naturalisation as a Chinese national, and renunciation and restoration of Chinese nationality through Chinese diplomatic and consular missions. It also provides assistance to Hong Kong residents in distress outside Hong Kong.",18.4,11.2,14.0,14.0
2008,70,0,total,,2251.5,2601.2,2624.6,2709.4
2008,72,1,Corruption Prevention,"The aim is to identify and eliminate opportunities for corruption in government departments and public bodies, and advise the private sector on corruption prevention.",46.2,47.3,51.2,52.3
2008,72,2,Operations,The aim is to enforce the law vigilantly and professionally in order to seek out and eradicate corruption wherever it exists.,503.1,537.6,527.0,575.3
2008,72,3,Preventive Education,The aim is to promote better public understanding of the corruption problem and encourage target groups to take positive action.,55.4,57.2,60.0,63.6
2008,72,4,Enlisting Support,"The aim is to promote public awareness of the evils of corruption, foster public confidence in and support for the work of the ICAC, and encourage reporting of corruption offences.",57.1,59.1,61.9,65.7
2008,72,0,total,,661.8,701.2,700.1,756.9
2008,74,1,Public Relations Outside Hong Kong,The aim is to promote a favourable image of Hong Kong internationally.,66.9,76.9,69.2,82.7
2008,74,2,Local Public Relations and Public Information,"The aim is to map out co-ordinated public relations strategies and plans for the presentation of government policies locally; and to convey to the public information on, and enhance public understanding of, government policies, plans, decisions, activities and services.",140.1,152.8,151.6,159.3
2008,74,3,Public Opinion,The aim is to keep the Government informed of public opinion as expressed through the media and to advise the Government on public reaction to government policies and measures.,17.4,18.5,16.7,18.2
2008,74,4,Civic Responsibility,"The aim is to enhance public awareness of, and educate the community on, issues of wide concern and promote a greater sense of civic responsibility.",34.2,36.6,39.9,44.1
2008,74,5,Publishing,The aim is to serve as the Government’s publishing agency.,58.4,63.1,64.0,65.7
2008,74,0,total,,317.0,347.9,341.4,370.0
2008,76,1,Assessing Functions,"The aim is to raise revenue through taxes, duties and fees in accordance with the relevant legislation in a cost-effective manner.",761.0,875.3,897.7,929.8
2008,76,2,Collection,The aim is to collect taxes due under the relevant Ordinances in a cost-effective manner.,114.6,121.1,121.2,128.0
2008,76,3,Investigation and Field Audit,"The aim is to counter tax evasion, minimise opportunities for tax avoidance and promote voluntary compliance by taxpayers.",158.8,163.2,166.8,172.5
2008,76,4,Taxpayer Services,"The aim is to provide a high level and quality of service to the public through the provision of timely and accurate tax information, thereby promoting voluntary tax compliance.",19.1,19.4,20.0,21.4
2008,76,0,total,,1053.5,1179.0,1205.7,1251.7
2008,78,1,Statutory Functions,"The aim is to provide cost-effective and efficient systems for the registration and administration of trademarks, patents, designs and copyright licensing bodies in Hong Kong.",61.4,64.9,63.1,70.9
2008,78,2,Protection of Intellectual Property,"The aims are to promote awareness of intellectual property rights, to enhance the reputation of Hong Kong in the protection of intellectual property rights in order to attract investment, and to protect existing and new types of intellectual property rights in line with international trends and standards. Particular attention is paid to providing support for small and medium enterprises (SMEs) to help them protect their intellectual property assets, both in Hong Kong and in the region.",18.2,22.1,20.9,21.8
2008,78,0,total,,79.6,87.0,84.0,92.7
2008,79,1,Investment Promotion,The aim is to attract and retain foreign direct investment and to maintain and develop Hong Kong as the leading international business location in Asia.,106.0,107.2,108.1,109.3
2008,79,0,total,,106.0,107.2,108.1,109.3
2008,80,1,"Courts, Tribunals and Various Statutory Functions","The aim is to maintain an independent and effective judicial system which upholds the rule of law, safeguards the rights and freedoms of the individual and commands confidence within and outside Hong Kong.",662.1,770.5,708.5,796.3
2008,80,2,Support Services for Courts’ Operation,The aim is to provide efficient and effective services to support the operation of courts.,216.4,225.1,221.7,248.5
2008,80,0,total,,878.5,995.6,930.2,1044.8
2008,82,1,Buildings and Building Works,"The aim is to promote building safety, set and enforce building standards and improve the quality of building development.",762.5,775.7,784.1,825.0
2008,82,0,total,,762.5,775.7,784.1,825.0
2008,90,1,Labour Relations,The aim is to foster and maintain harmonious employer-employee relations in the non-government sector.,104.6,108.2,113.5,119.5
2008,90,2,Employment Services,The aim is to provide a comprehensive range of free employment assistance and recruitment services to help job-seekers find suitable jobs and employers fill their vacancies.,316.3,355.2,336.2,356.4
2008,90,3,Safety and Health at Work,"The aim is to ensure that risks to the safety and health of people at work are properly managed by legislation, education and publicity efforts.",308.5,314.1,325.0,334.6
2008,90,4,Employee Rights and Benefits,The aim is to safeguard the rights and benefits of employees under labour laws.,182.3,194.9,284.8,206.3
2008,90,0,total,,911.7,972.4,1059.5,1016.8
2008,91,1,Land Administration,"The aim is to administer land in Hong Kong by disposing of land; acquiring private land and clearing land required for the implementation of public works and other projects; managing government leases, unleased land and certain buildings held by the Administration; renewing and modifying leases; and maintaining man-made slopes on unallocated and unleased government land.",1072.4,1197.5,1157.5,1240.5
2008,91,2,Survey and Mapping,"The aim is to formulate and implement survey and mapping policies, standards, regulations and specifications; provide and maintain the basic mapping, geodetic and land boundary databases; carry out geodetic, mapping and land boundary surveys; and administer the Land Survey Ordinance under the Land Survey Authority to cope with land and building developments in Hong Kong.",367.3,386.7,398.8,403.7
2008,91,3,Legal Advice,"The aim is to facilitate government land transactions by providing legal advice and conveyancing services to the departments and bureaux concerned, and to give consent to sales of units in uncompleted developments.",43.0,51.6,49.9,54.5
2008,91,0,total,,1482.7,1635.8,1606.2,1698.7
2008,92,1,Prosecutions,The aim is to advise and decide whether or not criminal proceedings should be undertaken and to prosecute cases in the courts.,340.0,387.3,355.2,389.1
2008,92,2,Civil,"The aim is to provide legal advice to the Government on civil matters, to undertake civil litigation and to draft contracts on commercial and other matters.",326.0,341.4,344.9,370.5
2008,92,3,Legal Policy,"The aim is to advise the Government on matters raising questions of legal policy; to assist in formulating policy, particularly in relation to the legal system and the legal profession; to provide support to the Secretary for Justice in relation to the discharge of his duties; to provide advice in respect of the Basic Law, human rights and constitutional affairs as well as the law and legal developments in the Mainland; and to review chosen areas of the law and provide secretariat support for the Law Reform Commission.",55.7,60.7,62.5,64.9
2008,92,4,Law Drafting,The aim is to draft legislation and to make the texts of legislation readily accessible.,69.9,82.3,74.1,83.7
2008,92,5,International Law,The aim is to provide advice on international law issues to the Government and to handle requests for international legal co-operation efficiently.,31.5,34.9,34.1,41.0
2008,92,0,total,,823.1,906.6,870.8,949.2
2008,94,1,Processing of Legal Aid Applications,The aim is to ensure that legal aid service is provided only to eligible applicants.,71.4,73.2,75.0,76.5
2008,94,2,Litigation Services,The aim is to discharge the Department’s statutory duties relating to assignment and conduct of legal aid cases.,521.3,611.0,559.9,638.2
2008,94,3,Support Services,"The aims are to provide effective support services for processing applications and conducting legal aid cases and for increasing public understanding and awareness of legal aid services, and to review or make recommendations on legal aid policy to meet areas of perceived needs.",27.1,28.6,29.3,29.6
2008,94,4,Official Solicitor’s Office,The aim is to provide representation to persons under a legal disability and to discharge the Official Solicitor’s duties as prescribed by the Official Solicitor Ordinance and other enactments.,9.0,9.7,9.4,14.6
2008,94,0,total,,628.8,722.5,673.6,758.9
2008,95,1,Recreation and Sports,"The aims are to develop and manage recreation and sports facilities and to organise a wide range of leisure activities in order to promote recreation and sports at all levels throughout the community, which include: • providing safe and good quality recreation and sports facilities for the public; • enhancing public awareness of the benefit of physical fitness and promoting regular participation in sports activities by all walks of life in the community; • promoting awareness of water sports safety in the Department’s venues; • organising physical recreation and sports activities for different age groups, including students and persons with a disability; and • improving the efficiency and cost-effectiveness in the provision of recreation and sports services.",2301.1,2382.8,2412.9,2391.3
2008,95,2,Horticulture and Amenities,"The aim is to promote appreciation and conservation of nature and greening of Hong Kong through planting of trees, shrubs and other plants in public parks and amenity areas and through organising a wide range of community greening activities, which include: • promoting awareness of the importance of greening, conservation of plants and protection of endangered species; and • maintaining the plants in public parks and gardens in their best form to enhance visual amenity.",530.5,546.1,548.3,572.3
2008,95,3,Heritage and Museums,"The aims are to preserve heritage and to provide museum services with a view to promoting appreciation of heritage, arts, science and culture, which include: • promoting Hong Kong’s heritage through publicity and educational activities; • conducting archaeological surveys and excavations; • declaring, where appropriate, buildings/structures as monuments and restoring/maintaining historic buildings/ structures; • providing quality museum services to the public; • providing a balanced mix of programmes, including staging of thematic exhibitions, educational activities and visitor services, and enhancing public appreciation of arts and culture and knowledge on local heritage; • acquiring, preserving, documenting and researching works of art, film and historical objects; and • computerising data on museum collections and archives, and rendering them easily accessible to the public.",484.3,526.5,523.0,570.4
2008,95,4,Performing Arts,"The aim is to promote performing and cinematic arts through the provision of cultural facilities and the presentation of programmes, which include: • maintaining a high standard of service in civic centres to meet the needs of the arts community and the public; • presenting cultural and entertainment programmes for the development of the performing and cinematic arts; and • organising audience building activities at schools and in the community to promote appreciation of the performing arts.",927.5,771.2,778.9,788.2
2008,95,5,Public Libraries,"The aims are to provide, manage and develop library services to meet community needs for knowledge, life-long learning, information, research and recreation, to offer library extension activities to all ages, and to promote reading and literary arts, which include: • enhancing the information and life-long learning roles of the libraries; • enhancing the use of information technology in the libraries; • strengthening the library collection to provide a balanced mix of library materials for free use by the public; • developing and maintaining close links with local and overseas libraries, cultural organisations and professional library bodies to promote inter-library co-operation and information exchange; and • promoting reading and fostering the development and appreciation of literature.",671.7,687.6,687.8,732.7
2008,95,0,total,,4915.1,4914.2,4950.9,5054.9
2008,96,1,Commercial Relations,The aim is to represent and promote Hong Kong’s trading and commercial interests outside Hong Kong.,104.6,142.0,127.0,146.5
2008,96,2,Public Relations,The aim is to promote Hong Kong as a reliable trading partner and a premier location for doing business.,82.9,109.8,98.1,113.0
2008,96,3,Investment Promotion,"The aim is to encourage and attract investments to Hong Kong, and to promote Hong Kong’s many advantages as an investment and business hub in Asia. The objective is to ensure that companies have all the support they need to establish operations in Hong Kong.",39.7,50.3,44.6,51.4
2008,96,0,total,,227.2,302.1,269.7,310.9
2008,100,1,Infrastructure,"The aim is to enhance the contribution of the port and shipping related activities to Hong Kong’s economy by furthering the interests of Hong Kong’s merchant shipping and ensuring the provision of the necessary physical, regulatory and policy bases.",36.6,38.3,39.8,40.5
2008,100,2,Port Services,"The aim is to enable ocean-going vessels (OGVs) using the port to conduct their business quickly, safely and economically.",296.0,319.7,310.5,325.1
2008,100,3,Local Services,The aim is to ensure the safe and efficient use of Hong Kong waters by locally licensed and river trade vessels.,88.6,92.8,92.0,96.9
2008,100,4,Services to Ships,"The aim is to ensure that Hong Kong-registered ships and locally licensed vessels comply with relevant international and local regulations and are designed, constructed, maintained and manned by competent crews for safe operation and protection of the marine environment.",57.5,62.6,62.1,66.4
2008,100,5,Government Fleet,The aim is to provide cost-effective marine transport services to government departments.,373.4,383.4,378.1,390.1
2008,100,0,total,,852.1,896.8,882.5,919.0
2008,112,1,Remuneration and Reimbursements for Members,The aim is to meet the remuneration and reimbursements for Members of the Legislative Council.,125.0,130.2,130.1,142.4
2008,112,2,General and Secretariat Services,"The aim is to provide secretariat support for the Legislative Council, The Legislative Council Commission and their committees; and to enhance public understanding of the work of the Legislative Council.",156.0,160.3,165.5,177.3
2008,112,3,Legal Service,"The aim is to provide an efficient and effective legal service for the Legislative Council, The Legislative Council Commission and the Legislative Council Secretariat.",24.1,23.5,26.0,27.7
2008,112,4,Redress System,The aim is to ensure that complaints and representations received are dealt with thoroughly and efficiently.,14.6,15.0,14.3,14.4
2008,112,5,Research and Library Services,The aim is to provide independent research and library support for the Council and its committees.,22.4,22.9,23.1,24.1
2008,112,0,total,,342.1,351.9,359.0,385.9
2008,114,1,Complaints Administration,"The aim is to redress grievances and address issues arising from maladministration in the public sector and to bring about improvements in the quality and standard of and promote fairness in the public administration, through independent and impartial investigations.",81.3,81.6,81.6,85.1
2008,114,0,total,,81.3,81.6,81.6,85.1
2008,116,1,Official Receiver’s Office,The aim is to administer the Companies Ordinance relating to the compulsory winding-up of companies and the Bankruptcy Ordinance relating to the estates of bankrupts.,107.4,132.3,115.1,134.3
2008,116,0,total,,107.4,132.3,115.1,134.3
2008,118,1,Territorial Planning,The aim is to provide guidance and direction for long-term development and investment in Hong Kong through the formulation and revision of territorial planning policies and development strategies and the undertaking of planning studies including research with a cross-boundary dimension.,72.7,94.5,93.0,93.2
2008,118,2,District Planning,The aim is to provide a rational pattern of land use to promote and guide development in the different parts of the territory through the execution of various statutory and non-statutory town planning functions at the district level.,244.3,254.0,260.0,279.8
2008,118,3,Ordinance Review,"The aim is to keep the TPO and related legislation under review, and achieve a more open and efficient planning system and better development control in keeping with changing needs and circumstances.",2.4,2.3,1.9,2.0
2008,118,4,Town Planning Information Services,The aim is to enhance public awareness of planning matters and to facilitate dissemination of planning information to the public.,12.4,14.0,15.3,15.3
2008,118,5,Technical Services,"The aim is to provide technical services and training opportunities to staff in various sections of the Department, with a view to enhancing the quality of planning work.",68.1,71.5,73.7,78.3
2008,118,0,total,,399.9,436.3,443.9,468.6
2008,120,1,Public and Judicial Service Pension Benefits,The aim is to make provision for the payment of public and judicial service pension benefits.,13616.5,15001.0,14881.0,16488.2
2008,120,2,War Memorial Pensions/Volunteer Pensions,The aim is to make provision for the payment of war memorial pensions and volunteer pensions.,37.8,39.4,36.8,36.8
2008,120,0,total,,13654.3,15040.4,14917.8,16525.0
2008,121,1,Police Complaints Administration,"The aim of the Secretariat of the Independent Police Complaints Council (IPCC) is to assist the Council to ensure that investigations by the Complaints Against Police Office (CAPO) of the Hong Kong Police Force are carried out in a thorough, impartial and efficient manner.",15.2,13.6,15.4,16.5
2008,121,0,total,,15.2,13.6,15.4,16.5
2008,122,1,Maintenance of Law and Order in the Community,The aim is to maintain law and order through the deployment of efficient and well-equipped uniformed police personnel throughout the land regions.,5243.4,5507.5,5624.0,5796.2
2008,122,2,Prevention and Detection of Crime,The aim is to prevent and detect crime.,2491.7,2268.2,2359.6,2446.2
2008,122,3,Road Safety,The aim is to maximise efforts to enhance road safety by reducing traffic accidents and maintaining a smooth and safe traffic flow in Hong Kong.,873.2,1129.5,1156.9,1192.5
2008,122,4,Operations,"The aim is to: • prevent and detect illegal immigration and smuggling; • prepare, revise and test contingency plans to ensure readiness to deal with illegal immigration, major disasters, civil disturbances and acts of terrorism; • maintain internal security of the territory; • provide specialist reinforcement to other programmes; and • manage major security and crowd management events.",2263.7,2448.0,2313.7,2478.7
2008,122,0,total,,10872.0,11353.2,11454.2,11913.6
2008,136,1,Public Service Commission,"The aim is to ensure that matters relating to appointments and promotions in the middle and senior ranks of the civil service, and discipline for virtually all ranks are processed in a proper and equitable manner and to advise the Chief Executive on the recommendations received from the Administration.",14.9,15.2,15.6,17.9
2008,136,0,total,,14.9,15.2,15.6,17.9
2008,137,1,Director of Bureau’s Office,The aim is to ensure the smooth operation of the Office of the Secretary for the Environment.,6.6,6.7,7.5,13.6
2008,137,2,Power,"The aims are to ensure reliable and efficient energy supply at reasonable prices through the established monitoring arrangements of the operation of the two power companies and the towngas supply company; to enhance electrical and gas safety through the introduction and enforcement of safety standards; and to raise public awareness of and achieve energy efficiency and conservation through education, promotion, and implementation of various programmes.",8.6,12.4,9.6,12.2
2008,137,3,Sustainable Development,The aim is to promote sustainable development (SD) in Hong Kong.,18.2,25.3,22.0,37.9
2008,137,0,total,,33.4,44.4,39.1,63.7
2008,138,1,Director of Bureau’s Office,The aim is to ensure the smooth operation of the Office of the Secretary for Development.,6.1,6.0,6.2,11.9
